Strongs,Book,BkOrder,Chapter,Verse,ID_Str,String
H5375,Gen,1,4,13,H5375-1-4-13,"And Cain said unto the LORD, My punishment is greater than I can bear. "
H3722,Gen,1,6,14,H3722-1-6-14,"Make thee an ark of gopher wood; rooms shalt thou make in the ark, and shalt pitch it within and without with pitch. "
H5375,Gen,1,7,17,H5375-1-7-17,"And the flood was forty days upon the earth; and the waters increased, and bare up the ark, and it was lift up above the earth. "
H5375,Gen,1,13,6,H5375-1-13-6,"And the land was not able to bear them, that they might dwell together: for their substance was great, so that they could not dwell together. "
H5375,Gen,1,13,10,H5375-1-13-10,"And Lot lifted up his eyes, and beheld all the plain of Jordan, that it was well watered every where, before the LORD destroyed Sodom and Gomorrah, even as the garden of the LORD, like the land of Egypt, as thou comest unto Zoar. "
H5375,Gen,1,13,14,H5375-1-13-14,"And the LORD said unto Abram, after that Lot was separated from him, Lift up now thine eyes, and look from the place where thou art northward, and southward, and eastward, and westward: "
H5375,Gen,1,18,2,H5375-1-18-2,"And he lift up his eyes and looked, and, lo, three men stood by him: and when he saw them, he ran to meet them from the tent door, and bowed himself toward the ground, "
H5375,Gen,1,18,24,H5375-1-18-24,Peradventure there be fifty righteous within the city: wilt thou also destroy and not spare the place for the fifty righteous that are therein? 
H5375,Gen,1,18,26,H5375-1-18-26,"And the LORD said, If I find in Sodom fifty righteous within the city, then I will spare all the place for their sakes."
H5375,Gen,1,19,21,H5375-1-19-21,"And he said unto him, See, I have accepted thee concerning this thing also, that I will not overthrow this city, for the which thou hast spoken. "
H5375,Gen,1,21,16,H5375-1-21-16,"And she went, and sat her down over against him a good way off, as it were a bowshot: for she said, Let me not see the death of the child. And she sat over against him, and lift up her voice, and wept. "
H5375,Gen,1,21,18,H5375-1-21-18,"Arise, lift up the lad, and hold him in thine hand; for I will make him a great nation. "
H5375,Gen,1,22,4,H5375-1-22-4,"Then on the third day Abraham lifted up his eyes, and saw the place afar off. "
H5375,Gen,1,22,13,H5375-1-22-13,"And Abraham lifted up his eyes, and looked, and behold behind him a ram caught in a thicket by his horns: and Abraham went and took the ram, and offered him up for a burnt offering in the stead of his son. "
H5375,Gen,1,24,63,H5375-1-24-63,"And Isaac went out to meditate in the field at the eventide: and he lifted up his eyes, and saw, and, behold, the camels were coming. "
H5375,Gen,1,24,64,H5375-1-24-64,"And Rebekah lifted up her eyes, and when she saw Isaac, she lighted off the camel. "
H5375,Gen,1,27,3,H5375-1-27-3,"Now therefore take, I pray thee, thy weapons, thy quiver and thy bow, and go out to the field, and take me some venison; "
H5375,Gen,1,27,38,H5375-1-27-38,"And Esau said unto his father, Hast thou but one blessing, my father? bless me, even me also, O my father. And Esau lifted up his voice, and wept. "
H5375,Gen,1,29,1,H5375-1-29-1,"Then Jacob went on his journey, and came into the land of the people of the east. "
H5375,Gen,1,29,11,H5375-1-29-11,"And Jacob kissed Rachel, and lifted up his voice, and wept. "
H5375,Gen,1,31,10,H5375-1-31-10,"And it came to pass at the time that the cattle conceived, that I lifted up mine eyes, and saw in a dream, and, behold, the rams which leaped upon the cattle were ringstraked, speckled, and grisled. "
H5375,Gen,1,31,12,H5375-1-31-12,"And he said, Lift up now thine eyes, and see, all the rams which leap upon the cattle are ringstraked, speckled, and grisled: for I have seen all that Laban doeth unto thee."
H5375,Gen,1,31,17,H5375-1-31-17,"Then Jacob rose up, and set his sons and his wives upon camels; "
H3722,Gen,1,32,20,H3722-1-32-20,"And say ye moreover, Behold, thy servant Jacob is behind us. For he said, I will appease him with the present that goeth before me, and afterward I will see his face; peradventure he will accept of me. "
H5375,Gen,1,32,20,H5375-1-32-20,"And say ye moreover, Behold, thy servant Jacob is behind us. For he said, I will appease him with the present that goeth before me, and afterward I will see his face; peradventure he will accept of me. "
H5375,Gen,1,33,1,H5375-1-33-1,"And Jacob lifted up his eyes, and looked, and, behold, Esau came, and with him four hundred men. And he divided the children unto Leah, and unto Rachel, and unto the two handmaids. "
H5375,Gen,1,33,5,H5375-1-33-5,"And he lifted up his eyes, and saw the women and the children; and said, Who are those with thee? And he said, The children which God hath graciously given thy servant. "
H5375,Gen,1,36,7,H5375-1-36-7,For their riches were more than that they might dwell together; and the land wherein they were strangers could not bear them because of their cattle. 
H5375,Gen,1,37,25,H5375-1-37-25,"And they sat down to eat bread: and they lifted up their eyes and looked, and, behold, a company of Ishmeelites came from Gilead with their camels bearing spicery and balm and myrrh, going to carry it down to Egypt. "
H5375,Gen,1,39,7,H5375-1-39-7,"And it came to pass after these things, that his master's wife cast her eyes upon Joseph; and she said, Lie with me."
H5375,Gen,1,40,13,H5375-1-40-13,"Yet within three days shall Pharaoh lift up thine head, and restore thee unto thy place: and thou shalt deliver Pharaoh's cup into his hand, after the former manner when thou wast his butler. "
H5375,Gen,1,40,19,H5375-1-40-19,"Yet within three days shall Pharaoh lift up thy head from off thee, and shall hang thee on a tree; and the birds shall eat thy flesh from off thee."
H5375,Gen,1,40,20,H5375-1-40-20,"And it came to pass the third day, which was Pharaoh's birthday, that he made a feast unto all his servants: and he lifted up the head of the chief butler and of the chief baker among his servants. "
H5375,Gen,1,42,26,H5375-1-42-26,"And they laded their asses with the corn, and departed thence."
H5375,Gen,1,43,29,H5375-1-43-29,"And he lifted up his eyes, and saw his brother Benjamin, his mother's son, and said, Is this your younger brother, of whom ye spake unto me? And he said, God be gracious unto thee, my son. "
H5375,Gen,1,43,34,H5375-1-43-34,"And he took and sent messes unto them from before him: but Benjamin's mess was five times so much as any of theirs. And they drank, and were merry with him."
H5375,Gen,1,44,1,H5375-1-44-1,"And he commanded the steward of his house, saying, Fill the men's sacks with food, as much as they can carry, and put every man's money in his sack's mouth. "
H5375,Gen,1,45,19,H5375-1-45-19,"Now thou art commanded, this do ye; take you wagons out of the land of Egypt for your little ones, and for your wives, and bring your father, and come. "
H5375,Gen,1,45,23,H5375-1-45-23,"And to his father he sent after this manner; ten asses laden with the good things of Egypt, and ten she asses laden with corn and bread and meat for his father by the way. "
H5375,Gen,1,45,27,H5375-1-45-27,"And they told him all the words of Joseph, which he had said unto them: and when he saw the wagons which Joseph had sent to carry him, the spirit of Jacob their father revived: "
H5375,Gen,1,46,5,H5375-1-46-5,"And Jacob rose up from Beersheba: and the sons of Israel carried Jacob their father, and their little ones, and their wives, in the wagons which Pharaoh had sent to carry him."
H5375,Gen,1,47,30,H5375-1-47-30,"But I will lie with my fathers, and thou shalt carry me out of Egypt, and bury me in their buryingplace. And he said, I will do as thou hast said. "
H5375,Gen,1,50,13,H5375-1-50-13,"For his sons carried him into the land of Canaan, and buried him in the cave of the field of Machpelah, which Abraham bought with the field for a possession of a buryingplace of Ephron the Hittite, before Mamre. "
H5375,Gen,1,50,17,H5375-1-50-17,"So shall ye say unto Joseph, Forgive, I pray thee now, the trespass of thy brethren, and their sin; for they did unto thee evil: and now, we pray thee, forgive the trespass of the servants of the God of thy father. And Joseph wept when they spake unto him."
H5375,Exo,2,6,8,H5375-2-6-8,"And I will bring you in unto the land, concerning the which I did swear to give it to Abraham, to Isaac, and to Jacob; and I will give it you for an heritage: I am the LORD. "
H5375,Exo,2,10,13,H5375-2-10-13,"And Moses stretched forth his rod over the land of Egypt, and the LORD brought an east wind upon the land all that day, and all that night; and when it was morning, the east wind brought the locusts. "
H5375,Exo,2,10,17,H5375-2-10-17,"Now therefore forgive, I pray thee, my sin only this once, and intreat the LORD your God, that he may take away from me this death only."
H5375,Exo,2,10,19,H5375-2-10-19,"And the LORD turned a mighty strong west wind, which took away the locusts, and cast them into the Red sea; there remained not one locust in all the coasts of Egypt. "
H5375,Exo,2,12,34,H5375-2-12-34,"And the people took their dough before it was leavened, their kneadingtroughs being bound up in their clothes upon their shoulders. "
H5375,Exo,2,14,10,H5375-2-14-10,"And when Pharaoh drew nigh, the children of Israel lifted up their eyes, and, behold, the Egyptians marched after them; and they were sore afraid: and the children of Israel cried out unto the LORD. "
H5375,Exo,2,18,22,H5375-2-18-22,"And let them judge the people at all seasons: and it shall be, that every great matter they shall bring unto thee, but every small matter they shall judge: so shall it be easier for thyself, and they shall bear the burden with thee."
H5375,Exo,2,19,4,H5375-2-19-4,"Ye have seen what I did unto the Egyptians, and how I bare you on eagles' wings, and brought you unto myself."
H5375,Exo,2,20,7,H5375-2-20-7,Thou shalt not take the name of the LORD thy God in vain; for the LORD will not hold him guiltless that taketh his name in vain. 
H5375,Exo,2,23,1,H5375-2-23-1,Thou shalt not raise a false report: put not thine hand with the wicked to be an unrighteous witness. 
H5375,Exo,2,23,21,H5375-2-23-21,"Beware of him, and obey his voice, provoke him not; for he will not pardon your transgressions: for my name is in him. "
H5375,Exo,2,25,14,H5375-2-25-14,"And thou shalt put the staves into the rings by the sides of the ark, that the ark may be borne with them."
H5375,Exo,2,25,27,H5375-2-25-27,Over against the border shall the rings be for places of the staves to bear the table. 
H5375,Exo,2,25,28,H5375-2-25-28,"And thou shalt make the staves of shittim wood, and overlay them with gold, that the table may be borne with them."
H5375,Exo,2,27,7,H5375-2-27-7,"And the staves shall be put into the rings, and the staves shall be upon the two sides of the altar, to bear it."
H5375,Exo,2,28,12,H5375-2-28-12,And thou shalt put the two stones upon the shoulders of the ephod for stones of memorial unto the children of Israel: and Aaron shall bear their names before the LORD upon his two shoulders for a memorial. 
H5375,Exo,2,28,29,H5375-2-28-29,"And Aaron shall bear the names of the children of Israel in the breastplate of judgment upon his heart, when he goeth in unto the holy place, for a memorial before the LORD continually. "
H5375,Exo,2,28,30,H5375-2-28-30,"And thou shalt put in the breastplate of judgment the Urim and the Thummim; and they shall be upon Aaron's heart, when he goeth in before the LORD: and Aaron shall bear the judgment of the children of Israel upon his heart before the LORD continually. "
H5375,Exo,2,28,38,H5375-2-28-38,"And it shall be upon Aaron's forehead, that Aaron may bear the iniquity of the holy things, which the children of Israel shall hallow in all their holy gifts; and it shall be always upon his forehead, that they may be accepted before the LORD. "
H5375,Exo,2,28,43,H5375-2-28-43,"And they shall be upon Aaron, and upon his sons, when they come in unto the tabernacle of the congregation, or when they come near unto the altar to minister in the holy place; that they bear not iniquity, and die: it shall be a statute for ever unto him and his seed after him."
H3722,Exo,2,29,33,H3722-2-29-33,"And they shall eat those things wherewith the atonement was made, to consecrate and to sanctify them: but a stranger shall not eat thereof, because they are holy. "
H3722,Exo,2,29,36,H3722-2-29-36,"And thou shalt offer every day a bullock for a sin offering for atonement: and thou shalt cleanse the altar, when thou hast made an atonement for it, and thou shalt anoint it, to sanctify it."
H3722,Exo,2,29,37,H3722-2-29-37,"Seven days thou shalt make an atonement for the altar, and sanctify it; and it shall be an altar most holy: whatsoever toucheth the altar shall be holy. "
H5375,Exo,2,30,4,H5375-2-30-4,"And two golden rings shalt thou make to it under the crown of it, by the two corners thereof, upon the two sides of it shalt thou make it; and they shall be for places for the staves to bear it withal. "
H3722,Exo,2,30,10,H3722-2-30-10,And Aaron shall make an atonement upon the horns of it once in a year with the blood of the sin offering of atonements: once in the year shall he make atonement upon it throughout your generations: it is most holy unto the LORD. 
H5375,Exo,2,30,12,H5375-2-30-12,"When thou takest the sum of the children of Israel after their number, then shall they give every man a ransom for his soul unto the LORD, when thou numberest them; that there be no plague among them, when thou numberest them."
H3722,1Sa,9,3,14,H3722-9-3-14,"And therefore I have sworn unto the house of Eli, that the iniquity of Eli's house shall not be purged with sacrifice nor offering for ever. "
H3722,2Sa,10,21,3,H3722-10-21-3,"Wherefore David said unto the Gibeonites, What shall I do for you? and wherewith shall I make the atonement, that ye may bless the inheritance of the LORD? "
H3722,1Ch,13,6,49,H3722-13-6-49,"But Aaron and his sons offered upon the altar of the burnt offering, and on the altar of incense, and were appointed for all the work of the place most holy, and to make an atonement for Israel, according to all that Moses the servant of God had commanded. "
H3722,2Ch,14,29,24,H3722-14-29-24,"And the priests killed them, and they made reconciliation with their blood upon the altar, to make an atonement for all Israel: for the king commanded that the burnt offering and the sin offering should be made for all Israel. "
H3722,2Ch,14,30,18,H3722-14-30-18,"For a multitude of the people, even many of Ephraim, and Manasseh, Issachar, and Zebulun, had not cleansed themselves, yet did they eat the passover otherwise than it was written. But Hezekiah prayed for them, saying, The good LORD pardon every one"
H3722,Neh,16,10,33,H3722-16-10-33,"For the shewbread, and for the continual meat offering, and for the continual burnt offering, of the sabbaths, of the new moons, for the set feasts, and for the holy things, and for the sin offerings to make an atonement for Israel, and for all the work of the house of our God. "
H3722,Psa,19,65,3,H3722-19-65-3,"Iniquities prevail against me: as for our transgressions, thou shalt purge them away. "
H3722,Psa,19,78,38,H3722-19-78-38,"But he, being full of compassion, forgave their iniquity, and destroyed them not: yea, many a time turned ➔ he his anger away, and did not stir up all his wrath. "
H3722,Psa,19,79,9,H3722-19-79-9,"Help us, O God of our salvation, for the glory of thy name: and deliver us, and purge away our sins, for thy name's sake."
H3722,Pro,20,16,6,H3722-20-16-6,By mercy and truth iniquity is purged: and by the fear of the LORD men depart from evil. 
H3722,Pro,20,16,14,H3722-20-16-14,The wrath of a king is as messengers of death: but a wise man will pacify it.
H3722,Isa,23,6,7,H3722-23-6-7,"And he laid it upon my mouth, and said, Lo, this hath touched thy lips; and thine iniquity is taken away, and thy sin purged. "
H3722,Isa,23,22,14,H3722-23-22-14,"And it was revealed in mine ears by the LORD of hosts, Surely this iniquity shall not be purged from you till ye die, saith the Lord GOD of hosts. "
H3722,Isa,23,27,9,H3722-23-27-9,"By this therefore shall the iniquity of Jacob be purged; and this is all the fruit to take away his sin; when he maketh all the stones of the altar as chalkstones that are beaten in sunder, the groves and images shall not stand up. "
H3722,Isa,23,28,18,H3722-23-28-18,"And your covenant with death shall be disannulled, and your agreement with hell shall not stand; when the overflowing scourge shall pass through, then ye shall be trodden down by it."
H3722,Isa,23,47,11,H3722-23-47-11,"Therefore shall evil come upon thee; thou shalt not know from whence it riseth: and mischief shall fall upon thee; thou shalt not be able to put it off: and desolation shall come upon thee suddenly, which thou shalt not know. "
H3722,Jer,24,18,23,H3722-24-18-23,"Yet, LORD, thou knowest all their counsel against me to slay me: forgive not their iniquity, neither blot out their sin from thy sight, but let them be overthrown before thee; deal thus with them in the time of thine anger. "
H3722,Eze,26,16,63,H3722-26-16-63,"That thou mayest remember, and be confounded, and never open thy mouth any more because of thy shame, when I am pacified toward thee for all that thou hast done, saith the Lord GOD. "
H3722,Eze,26,43,20,H3722-26-43-20,"And thou shalt take of the blood thereof, and put it on the four horns of it, and on the four corners of the settle, and upon the border round about: thus shalt thou cleanse and purge it."
H3722,Eze,26,43,26,H3722-26-43-26,Seven days shall they purge the altar and purify it; and they shall consecrate themselves. 
H3722,Eze,26,45,15,H3722-26-45-15,"And one lamb out of the flock, out of two hundred, out of the fat pastures of Israel; for a meat offering, and for a burnt offering, and for peace offerings, to make reconciliation for them, saith the Lord GOD. "
H3722,Eze,26,45,17,H3722-26-45-17,"And it shall be the prince's part to give burnt offerings, and meat offerings, and drink offerings, in the feasts, and in the new moons, and in the sabbaths, in all solemnities of the house of Israel: he shall prepare the sin offering, and the meat offering, and the burnt offering, and the peace offerings, to make reconciliation for the house of Israel. "
H3722,Eze,26,45,20,H3722-26-45-20,"And so thou shalt do the seventh day of the month for every one that erreth, and for him that is simple: so shall ye reconcile the house. "
H3722,Dan,27,9,24,H3722-27-9-24,"Seventy weeks are determined upon thy people and upon thy holy city, to finish the transgression, and to make an end of sins, and to make reconciliation for iniquity, and to bring in everlasting righteousness, and to seal up the vision and prophecy, and to anoint the most Holy. "
H3722,Exo,2,30,15,H3722-2-30-15,"The rich shall not give more, and the poor shall not give less than half a shekel, when they give an offering unto the LORD, to make an atonement for your souls. "
H3722,Exo,2,30,16,H3722-2-30-16,"And thou shalt take the atonement money of the children of Israel, and shalt appoint it for the service of the tabernacle of the congregation; that it may be a memorial unto the children of Israel before the LORD, to make an atonement for your souls. "
H3722,Exo,2,32,30,H3722-2-32-30,"And it came to pass on the morrow, that Moses said unto the people, Ye have sinned a great sin: and now I will go up unto the LORD; peradventure I shall make an atonement for your sin. "
H5375,Exo,2,32,32,H5375-2-32-32,"Yet now, if thou wilt forgive their sin—; and if not, blot me, I pray thee, out of thy book which thou hast written. "
H5375,Exo,2,34,7,H5375-2-34-7,"Keeping mercy for thousands, forgiving iniquity and transgression and sin, and that will by no means clear the guilty; visiting the iniquity of the fathers upon the children, and upon the children's children, unto the third and to the fourth generation."
H5545,Exo,2,34,9,H5545-2-34-9,"And he said, If now I have found grace in thy sight, O Lord, let my Lord, I pray thee, go among us; for it is a stiffnecked people; and pardon our iniquity and our sin, and take us for thine inheritance. "
H5375,Exo,2,35,21,H5375-2-35-21,"And they came, every one whose heart stirred him up, and every one whom his spirit made willing, and they brought the LORD'S offering to the work of the tabernacle of the congregation, and for all his service, and for the holy garments. "
H5375,Exo,2,35,26,H5375-2-35-26,And all the women whose heart stirred them up in wisdom spun goats' hair.
H5375,Exo,2,36,2,H5375-2-36-2,"And Moses called Bezaleel and Aholiab, and every wise hearted man, in whose heart the LORD had put wisdom, even every one whose heart stirred him up to come unto the work to do it:"
H5375,Exo,2,37,5,H5375-2-37-5,"And he put the staves into the rings by the sides of the ark, to bear the ark. "
H5375,Exo,2,37,14,H5375-2-37-14,"Over against the border were the rings, the places for the staves to bear the table. "
H5375,Exo,2,37,15,H5375-2-37-15,"And he made the staves of shittim wood, and overlaid them with gold, to bear the table. "
H5375,Exo,2,37,27,H5375-2-37-27,"And he made two rings of gold for it under the crown thereof, by the two corners of it, upon the two sides thereof, to be places for the staves to bear it withal."
H5375,Exo,2,38,7,H5375-2-38-7,"And he put the staves into the rings on the sides of the altar, to bear it withal; he made the altar hollow with boards. "
H3722,Lev,3,1,4,H3722-3-1-4,And he shall put his hand upon the head of the burnt offering; and it shall be accepted for him to make atonement for him.
H3722,Lev,3,4,20,H3722-3-4-20,"And he shall do with the bullock as he did with the bullock for a sin offering, so shall he do with this: and the priest shall make an atonement for them, and it shall be forgiven them."
H5545,Lev,3,4,20,H5545-3-4-20,"And he shall do with the bullock as he did with the bullock for a sin offering, so shall he do with this: and the priest shall make an atonement for them, and it shall be forgiven them."
H3722,Lev,3,4,26,H3722-3-4-26,"And he shall burn all his fat upon the altar, as the fat of the sacrifice of peace offerings: and the priest shall make an atonement for him as concerning his sin, and it shall be forgiven him."
H5545,Lev,3,4,26,H5545-3-4-26,"And he shall burn all his fat upon the altar, as the fat of the sacrifice of peace offerings: and the priest shall make an atonement for him as concerning his sin, and it shall be forgiven him."
H3722,Lev,3,4,31,H3722-3-4-31,"And he shall take away all the fat thereof, as the fat is taken away from off the sacrifice of peace offerings; and the priest shall burn it upon the altar for a sweet savour unto the LORD; and the priest shall make an atonement for him, and it shall be forgiven him."
H5545,Lev,3,4,31,H5545-3-4-31,"And he shall take away all the fat thereof, as the fat is taken away from off the sacrifice of peace offerings; and the priest shall burn it upon the altar for a sweet savour unto the LORD; and the priest shall make an atonement for him, and it shall be forgiven him."
H3722,Lev,3,4,35,H3722-3-4-35,"And he shall take away all the fat thereof, as the fat of the lamb is taken away from the sacrifice of the peace offerings; and the priest shall burn them upon the altar, according to the offerings made by fire unto the LORD: and the priest shall make an atonement for his sin that he hath committed, and it shall be forgiven him."
H5545,Lev,3,4,35,H5545-3-4-35,"And he shall take away all the fat thereof, as the fat of the lamb is taken away from the sacrifice of the peace offerings; and the priest shall burn them upon the altar, according to the offerings made by fire unto the LORD: and the priest shall make an atonement for his sin that he hath committed, and it shall be forgiven him."
H5375,Lev,3,5,1,H5375-3-5-1,"And if a soul sin, and hear the voice of swearing, and is a witness, whether he hath seen or known of it; if he do not utter it, then he shall bear his iniquity. "
H3722,Lev,3,5,6,H3722-3-5-6,"And he shall bring his trespass offering unto the LORD for his sin which he hath sinned, a female from the flock, a lamb or a kid of the goats, for a sin offering; and the priest shall make an atonement for him concerning his sin. "
H3722,Lev,3,5,10,H3722-3-5-10,"And he shall offer the second for a burnt offering, according to the manner: and the priest shall make an atonement for him for his sin which he hath sinned, and it shall be forgiven him."
H5545,Lev,3,5,10,H5545-3-5-10,"And he shall offer the second for a burnt offering, according to the manner: and the priest shall make an atonement for him for his sin which he hath sinned, and it shall be forgiven him."
H3722,Lev,3,5,13,H3722-3-5-13,"And the priest shall make an atonement for him as touching his sin that he hath sinned in one of these, and it shall be forgiven him: and the remnant shall be the priest's, as a meat offering. "
H5545,Lev,3,5,13,H5545-3-5-13,"And the priest shall make an atonement for him as touching his sin that he hath sinned in one of these, and it shall be forgiven him: and the remnant shall be the priest's, as a meat offering. "
H3722,Lev,3,5,16,H3722-3-5-16,"And he shall make amends for the harm that he hath done in the holy thing, and shall add the fifth part thereto, and give it unto the priest: and the priest shall make an atonement for him with the ram of the trespass offering, and it shall be forgiven him."
H5545,Lev,3,5,16,H5545-3-5-16,"And he shall make amends for the harm that he hath done in the holy thing, and shall add the fifth part thereto, and give it unto the priest: and the priest shall make an atonement for him with the ram of the trespass offering, and it shall be forgiven him."
