Strongs,Book,BkOrder,Chapter,Verse,ID_Str,String
H5375,Eze,26,23,35,H5375-26-23-35,"Therefore thus saith the Lord GOD; Because thou hast forgotten me, and cast me behind thy back, therefore bear thou also thy lewdness and thy whoredoms. "
H5375,Eze,26,23,49,H5375-26-23-49,"And they shall recompense your lewdness upon you, and ye shall bear the sins of your idols: and ye shall know that I am the Lord GOD. "
H5375,Eze,26,26,17,H5375-26-26-17,"And they shall take up a lamentation for thee, and say to thee, How art thou destroyed, that wast inhabited of seafaring men, the renowned city, which wast strong in the sea, she and her inhabitants, which cause their terror to be on all that haunt it!"
H5375,Eze,26,27,2,H5375-26-27-2,"Now, thou son of man, take up a lamentation for Tyrus; "
H5375,Eze,26,27,32,H5375-26-27-32,"And in their wailing they shall take up a lamentation for thee, and lament over thee, saying, What city is like Tyrus, like the destroyed in the midst of the sea? "
H5375,Eze,26,28,12,H5375-26-28-12,"Son of man, take up a lamentation upon the king of Tyrus, and say unto him, Thus saith the Lord GOD; Thou sealest up the sum, full of wisdom, and perfect in beauty. "
H5375,Eze,26,29,15,H5375-26-29-15,"It shall be the basest of the kingdoms; neither shall it exalt itself any more above the nations: for I will diminish them, that they shall no more rule over the nations. "
H5375,Eze,26,29,19,H5375-26-29-19,"Therefore thus saith the Lord GOD; Behold, I will give the land of Egypt unto Nebuchadrezzar king of Babylon; and he shall take her multitude, and take her spoil, and take her prey; and it shall be the wages for his army. "
H5375,Eze,26,32,2,H5375-26-32-2,"Son of man, take up a lamentation for Pharaoh king of Egypt, and say unto him, Thou art like a young lion of the nations, and thou art as a whale in the seas: and thou camest forth with thy rivers, and troubledst the waters with thy feet, and fouledst their rivers. "
H5375,Eze,26,32,24,H5375-26-32-24,"There is Elam and all her multitude round about her grave, all of them slain, fallen by the sword, which are gone down uncircumcised into the nether parts of the earth, which caused their terror in the land of the living; yet have they borne their shame with them that go down to the pit. "
H5375,Eze,26,32,25,H5375-26-32-25,"They have set her a bed in the midst of the slain with all her multitude: her graves are round about him: all of them uncircumcised, slain by the sword: though their terror was caused in the land of the living, yet have they borne their shame with them that go down to the pit: he is put in the midst of them that be slain. "
H5375,Eze,26,32,30,H5375-26-32-30,"There be the princes of the north, all of them, and all the Zidonians, which are gone down with the slain; with their terror they are ashamed of their might; and they lie uncircumcised with them that be slain by the sword, and bear their shame with them that go down to the pit. "
H5375,Eze,26,33,25,H5375-26-33-25,"Wherefore say unto them, Thus saith the Lord GOD; Ye eat with the blood, and lift up your eyes toward your idols, and shed blood: and shall ye possess the land? "
H5375,Eze,26,34,29,H5375-26-34-29,"And I will raise up for them a plant of renown, and they shall be no more consumed with hunger in the land, neither bear the shame of the heathen any more."
H5375,Eze,26,36,6,H5375-26-36-6,"Prophesy therefore concerning the land of Israel, and say unto the mountains, and to the hills, to the rivers, and to the valleys, Thus saith the Lord GOD; Behold, I have spoken in my jealousy and in my fury, because ye have borne the shame of the heathen: "
H5375,Eze,26,36,7,H5375-26-36-7,"Therefore thus saith the Lord GOD; I have lifted up mine hand, Surely the heathen that are about you, they shall bear their shame. "
H5375,Eze,26,36,8,H5375-26-36-8,"But ye, O mountains of Israel, ye shall shoot forth your branches, and yield your fruit to my people of Israel; for they are at hand to come. "
H5375,Eze,26,36,15,H5375-26-36-15,"Neither will I cause men to hear in thee the shame of the heathen any more, neither shalt thou bear the reproach of the people any more, neither shalt thou cause thy nations to fall any more, saith the Lord GOD. "
H5375,Eze,26,38,13,H5375-26-38-13,"Sheba, and Dedan, and the merchants of Tarshish, with all the young lions thereof, shall say unto thee, Art thou come to take a spoil? hast thou gathered thy company to take a prey? to carry away silver and gold, to take away cattle and goods, to take a great spoil? "
H5375,Eze,26,39,10,H5375-26-39-10,"So that they shall take no wood out of the field, neither cut down any out of the forests; for they shall burn the weapons with fire: and they shall spoil those that spoiled them, and rob those that robbed them, saith the Lord GOD. "
H5375,Eze,26,39,26,H5375-26-39-26,"After that they have borne their shame, and all their trespasses whereby they have trespassed against me, when they dwelt safely in their land, and none made them afraid. "
H5375,Eze,26,43,5,H5375-26-43-5,"So the spirit took me up, and brought me into the inner court; and, behold, the glory of the LORD filled the house. "
H5375,Eze,26,44,10,H5375-26-44-10,"And the Levites that are gone away far from me, when Israel went astray, which went astray away from me after their idols; they shall even bear their iniquity. "
H5375,Eze,26,44,12,H5375-26-44-12,"Because they ministered unto them before their idols, and caused the house of Israel to fall into iniquity; therefore have I lifted up mine hand against them, saith the Lord GOD, and they shall bear their iniquity. "
H5375,Eze,26,44,13,H5375-26-44-13,"And they shall not come near unto me, to do the office of a priest unto me, nor to come near to any of my holy things, in the most holy place: but they shall bear their shame, and their abominations which they have committed. "
H5375,Eze,26,45,11,H5375-26-45-11,"The ephah and the bath shall be of one measure, that the bath may contain the tenth part of an homer, and the ephah the tenth part of an homer: the measure thereof shall be after the homer. "
H5375,Eze,26,47,14,H5375-26-47-14,"And ye shall inherit it, one as well as another: concerning the which I lifted up mine hand to give it unto your fathers: and this land shall fall unto you for inheritance. "
H5375,Dan,27,1,16,H5375-27-1-16,"Thus Melzar took away the portion of their meat, and the wine that they should drink; and gave them pulse. "
H5375,Dan,27,8,3,H5375-27-8-3,"Then I lifted up mine eyes, and saw, and, behold, there stood before the river a ram which had two horns: and the two horns were high; but one was higher than the other, and the higher came up last. "
H5375,Dan,27,10,5,H5375-27-10-5,"Then I lifted up mine eyes, and looked, and behold a certain man clothed in linen, whose loins were girded with fine gold of Uphaz: "
H5375,Dan,27,11,12,H5375-27-11-12,"And when he hath taken away the multitude, his heart shall be lifted up; and he shall cast down many ten thousands: but he shall not be strengthened by it."
H5375,Dan,27,11,14,H5375-27-11-14,And in those times there shall many stand up against the king of the south: also the robbers of thy people shall exalt themselves to establish the vision; but they shall fall. 
H5375,Hos,28,1,6,H5375-28-1-6,"And she conceived again, and bare a daughter. And God said unto him, Call her name Loruhamah: for I will no more have mercy upon the house of Israel; but I will utterly take them away. "
H5375,Hos,28,4,8,H5375-28-4-8,"They eat up the sin of my people, and they set their heart on their iniquity. "
H5375,Hos,28,5,14,H5375-28-5-14,"For I will be unto Ephraim as a lion, and as a young lion to the house of Judah: I, even I, will tear and go away; I will take away, and none shall rescue him."
H5375,Hos,28,13,1,H5375-28-13-1,"When Ephraim spake trembling, he exalted himself in Israel; but when he offended in Baal, he died. "
H5375,Hos,28,14,2,H5375-28-14-2,"Take with you words, and turn to the LORD: say unto him, Take away all iniquity, and receive us graciously: so will we render the calves of our lips. "
H5375,Joe,29,2,22,H5375-29-2-22,"Be not afraid, ye beasts of the field: for the pastures of the wilderness do spring, for the tree beareth her fruit, the fig tree and the vine do yield their strength. "
H5375,Amo,30,4,2,H5375-30-4-2,"The Lord GOD hath sworn by his holiness, that, lo, the days shall come upon you, that he will take you away with hooks, and your posterity with fishhooks. "
H5375,Amo,30,5,1,H5375-30-5-1,"Hear ye this word which I take up against you, even a lamentation, O house of Israel. "
H5375,Amo,30,5,26,H5375-30-5-26,"But ye have borne the tabernacle of your Moloch and Chiun your images, the star of your god, which ye made to yourselves."
H5375,Amo,30,6,10,H5375-30-6-10,"And a man's uncle shall take him up, and he that burneth him, to bring out the bones out of the house, and shall say unto him that is by the sides of the house, Is there yet any with thee? and he shall say, No. Then shall he say, Hold thy tongue: for we may not make mention of the name of the LORD. "
H5375,Jon,32,1,12,H5375-32-1-12,"And he said unto them, Take me up, and cast me forth into the sea; so shall the sea be calm unto you: for I know that for my sake this great tempest is upon you."
H5375,Jon,32,1,15,H5375-32-1-15,"So they took up Jonah, and cast him forth into the sea: and the sea ceased from her raging. "
H5375,Mic,33,2,2,H5375-33-2-2,"And they covet fields, and take them by violence; and houses, and take them away: so they oppress a man and his house, even a man and his heritage. "
H5375,Mic,33,2,4,H5375-33-2-4,"In that day shall one take up a parable against you, and lament with a doleful lamentation, and say, We be utterly spoiled: he hath changed the portion of my people: how hath he removed it from me! turning away he hath divided our fields. "
H5375,Mic,33,4,1,H5375-33-4-1,"But in the last days it shall come to pass, that the mountain of the house of the LORD shall be established in the top of the mountains, and it shall be exalted above the hills; and people shall flow unto it."
H5375,Mic,33,4,3,H5375-33-4-3,"And he shall judge among many people, and rebuke strong nations afar off; and they shall beat their swords into plowshares, and their spears into pruninghooks: nation shall not lift up a sword against nation, neither shall they learn war any more."
H5375,Mic,33,6,16,H5375-33-6-16,"For the statutes of Omri are kept, and all the works of the house of Ahab, and ye walk in their counsels; that I should make thee a desolation, and the inhabitants thereof an hissing: therefore ye shall bear the reproach of my people. "
H5375,Mic,33,7,9,H5375-33-7-9,"I will bear the indignation of the LORD, because I have sinned against him, until he plead my cause, and execute judgment for me: he will bring me forth to the light, and I shall behold his righteousness. "
H5375,Mic,33,7,18,H5375-33-7-18,"Who is a God like unto thee, that pardoneth iniquity, and passeth by the transgression of the remnant of his heritage? he retaineth not his anger for ever, because he delighteth in mercy. "
H5375,Nah,34,1,5,H5375-34-1-5,"The mountains quake at him, and the hills melt, and the earth is burned at his presence, yea, the world, and all that dwell therein."
H5375,Hab,35,1,3,H5375-35-1-3,"Why dost thou shew me iniquity, and cause me to behold grievance? for spoiling and violence are before me: and there are that raise up strife and contention. "
H5375,Hab,35,2,6,H5375-35-2-6,"Shall not all these take up a parable against him, and a taunting proverb against him, and say, Woe to him that increaseth that which is not his! how long? and to him that ladeth himself with thick clay! "
H5375,Hab,35,3,10,H5375-35-3-10,"The mountains saw thee, and they trembled: the overflowing of the water passed by: the deep uttered his voice, and lifted up his hands on high. "
H5375,Hag,37,2,12,H5375-37-2-12,"If one bear holy flesh in the skirt of his garment, and with his skirt do touch bread, or pottage, or wine, or oil, or any meat, shall it be holy? And the priests answered and said, No."
H5375,Hag,37,2,19,H5375-37-2-19,"Is the seed yet in the barn? yea, as yet the vine, and the fig tree, and the pomegranate, and the olive tree, hath not brought forth: from this day will I bless you."
H5375,Zec,38,1,18,H5375-38-1-18,"Then lifted I up mine eyes, and saw, and behold four horns. "
H5375,Zec,38,1,21,H5375-38-1-21,"Then said I, What come these to do? And he spake, saying, These are the horns which have scattered Judah, so that no man did lift up his head: but these are come to fray them, to cast out the horns of the Gentiles, which lifted up their horn over the land of Judah to scatter it."
H5375,Zec,38,2,1,H5375-38-2-1,"I lifted up mine eyes again, and looked, and behold a man with a measuring line in his hand. "
H5375,Zec,38,5,1,H5375-38-5-1,"Then I turned, and lifted up mine eyes, and looked, and behold a flying roll. "
H5375,Zec,38,5,5,H5375-38-5-5,"Then the angel that talked with me went forth, and said unto me, Lift up now thine eyes, and see what is this that goeth forth. "
H5375,Zec,38,5,7,H5375-38-5-7,"And, behold, there was lifted up a talent of lead: and this is a woman that sitteth in the midst of the ephah. "
H5375,Zec,38,5,9,H5375-38-5-9,"Then lifted I up mine eyes, and looked, and, behold, there came out two women, and the wind was in their wings; for they had wings like the wings of a stork: and they lifted up the ephah between the earth and the heaven. "
H5375,Zec,38,6,1,H5375-38-6-1,"And I turned, and lifted up mine eyes, and looked, and, behold, there came ➔ four chariots out from between two mountains; and the mountains were mountains of brass. "
H5375,Zec,38,6,13,H5375-38-6-13,"Even he shall build the temple of the LORD; and he shall bear the glory, and shall sit and rule upon his throne; and he shall be a priest upon his throne: and the counsel of peace shall be between them both. "
H5375,Mal,39,1,8,H5375-39-1-8,"And if ye offer the blind for sacrifice, is it not evil? and if ye offer the lame and sick, is it not evil? offer it now unto thy governor; will he be pleased with thee, or accept thy person? saith the LORD of hosts. "
H5375,Mal,39,1,9,H5375-39-1-9,"And now, I pray you, beseech God that he will be gracious unto us: this hath been by your means: will he regard your persons? saith the LORD of hosts. "
H5375,Mal,39,2,3,H5375-39-2-3,"Behold, I will corrupt your seed, and spread dung upon your faces, even the dung of your solemn feasts; and one shall take you away with it."
H5375,Mal,39,2,9,H5375-39-2-9,"Therefore have I also made you contemptible and base before all the people, according as ye have not kept my ways, but have been partial in the law. "
H5375,Deu,5,1,12,H5375-5-1-12,"How can I myself alone bear your cumbrance, and your burden, and your strife? "
H5375,Deu,5,1,31,H5375-5-1-31,"And in the wilderness, where thou hast seen how that the LORD thy God bare thee, as a man doth bear his son, in all the way that ye went, until ye came into this place. "
H5375,Deu,5,3,27,H5375-5-3-27,"Get thee up into the top of Pisgah, and lift up thine eyes westward, and northward, and southward, and eastward, and behold it with thine eyes: for thou shalt not go over this Jordan. "
H5375,Deu,5,4,19,H5375-5-4-19,"And lest thou lift up thine eyes unto heaven, and when thou seest the sun, and the moon, and the stars, even all the host of heaven, shouldest be driven to worship them, and serve them, which the LORD thy God hath divided unto all nations under the whole heaven. "
H5375,Deu,5,5,11,H5375-5-5-11,Thou shalt not take the name of the LORD thy God in vain: for the LORD will not hold him guiltless that taketh his name in vain. 
H5375,Deu,5,10,8,H5375-5-10-8,"At that time the LORD separated the tribe of Levi, to bear the ark of the covenant of the LORD, to stand before the LORD to minister unto him, and to bless in his name, unto this day. "
H5375,Deu,5,10,17,H5375-5-10-17,"For the LORD your God is God of gods, and Lord of lords, a great God, a mighty, and a terrible, which regardeth not persons, nor taketh reward: "
H5375,Deu,5,12,26,H5375-5-12-26,"Only thy holy things which thou hast, and thy vows, thou shalt take, and go unto the place which the LORD shall choose: "
H5375,Deu,5,14,24,H5375-5-14-24,"And if the way be too long for thee, so that thou art not able to carry it; or if the place be too far from thee, which the LORD thy God shall choose to set his name there, when the LORD thy God hath blessed thee:"
H3722,Deu,5,21,8,H3722-5-21-8,"Be merciful, O LORD, unto thy people Israel, whom thou hast redeemed, and lay not innocent blood unto thy people of Israel's charge. And the blood shall be forgiven them."
H5375,Deu,5,24,15,H5375-5-24-15,"At his day thou shalt give him his hire, neither shall the sun go down upon it; for he is poor, and setteth his heart upon it: lest he cry against thee unto the LORD, and it be sin unto thee."
H5375,Deu,5,28,49,H5375-5-28-49,"The LORD shall bring a nation against thee from far, from the end of the earth, as swift as the eagle flieth; a nation whose tongue thou shalt not understand; "
H5375,Deu,5,28,50,H5375-5-28-50,"A nation of fierce countenance, which shall not regard the person of the old, nor shew favour to the young: "
H5545,Deu,5,29,20,H5545-5-29-20,"The LORD will not spare him, but then the anger of the LORD and his jealousy shall smoke against that man, and all the curses that are written in this book shall lie upon him, and the LORD shall blot out his name from under heaven. "
H5375,Deu,5,31,9,H5375-5-31-9,"And Moses wrote this law, and delivered it unto the priests the sons of Levi, which bare the ark of the covenant of the LORD, and unto all the elders of Israel. "
H5375,Deu,5,31,25,H5375-5-31-25,"That Moses commanded the Levites, which bare the ark of the covenant of the LORD, saying, "
H5375,Deu,5,32,11,H5375-5-32-11,"As an eagle stirreth up her nest, fluttereth over her young, spreadeth abroad her wings, taketh them, beareth them on her wings: "
H5375,Deu,5,32,40,H5375-5-32-40,"For I lift up my hand to heaven, and say, I live for ever. "
H3722,Deu,5,32,43,H3722-5-32-43,"Rejoice, O ye nations, with his people: for he will avenge the blood of his servants, and will render vengeance to his adversaries, and will be merciful unto his land, and to his people. "
H5375,Deu,5,33,3,H5375-5-33-3,"Yea, he loved the people; all his saints are in thy hand: and they sat down at thy feet; every one shall receive of thy words. "
H5545,1Ki,11,8,30,H5545-11-8-30,"And hearken thou to the supplication of thy servant, and of thy people Israel, when they shall pray toward this place: and hear thou in heaven thy dwelling place: and when thou hearest, forgive. "
H5545,1Ki,11,8,34,H5545-11-8-34,"Then hear thou in heaven, and forgive the sin of thy people Israel, and bring them again unto the land which thou gavest unto their fathers. "
H5545,1Ki,11,8,36,H5545-11-8-36,"Then hear thou in heaven, and forgive the sin of thy servants, and of thy people Israel, that thou teach them the good way wherein they should walk, and give rain upon thy land, which thou hast given to thy people for an inheritance. "
H5545,1Ki,11,8,39,H5545-11-8-39,"Then hear thou in heaven thy dwelling place, and forgive, and do, and give to every man according to his ways, whose heart thou knowest; (for thou, even thou only, knowest the hearts of all the children of men;) "
H5545,1Ki,11,8,50,H5545-11-8-50,"And forgive thy people that have sinned against thee, and all their transgressions wherein they have transgressed against thee, and give them compassion before them who carried them captive, that they may have compassion on them:"
H5545,2Ki,12,5,18,H5545-12-5-18,"In this thing the LORD pardon thy servant, that when my master goeth into the house of Rimmon to worship there, and he leaneth on my hand, and I bow myself in the house of Rimmon: when I bow down myself in the house of Rimmon, the LORD pardon thy servant in this thing. "
H5545,2Ki,12,24,4,H5545-12-24-4,And also for the innocent blood that he shed: for he filled Jerusalem with innocent blood; which the LORD would not pardon. 
H5545,2Ch,14,6,21,H5545-14-6-21,"Hearken therefore unto the supplications of thy servant, and of thy people Israel, which they shall make toward this place: hear thou from thy dwelling place, even from heaven; and when thou hearest, forgive. "
H5545,2Ch,14,6,25,H5545-14-6-25,"Then hear thou from the heavens, and forgive the sin of thy people Israel, and bring them again unto the land which thou gavest to them and to their fathers. "
H5545,2Ch,14,6,27,H5545-14-6-27,"Then hear thou from heaven, and forgive the sin of thy servants, and of thy people Israel, when thou hast taught them the good way, wherein they should walk; and send rain upon thy land, which thou hast given unto thy people for an inheritance. "
H5545,2Ch,14,6,30,H5545-14-6-30,"Then hear thou from heaven thy dwelling place, and forgive, and render unto every man according unto all his ways, whose heart thou knowest; (for thou only knowest the hearts of the children of men:) "
H5545,2Ch,14,6,39,H5545-14-6-39,"Then hear thou from the heavens, even from thy dwelling place, their prayer and their supplications, and maintain their cause, and forgive thy people which have sinned against thee."
H5545,2Ch,14,7,14,H5545-14-7-14,"If my people, which are called by my name, shall humble themselves, and pray, and seek my face, and turn from their wicked ways; then will I hear from heaven, and will forgive their sin, and will heal their land. "
H5545,Psa,19,25,11,H5545-19-25-11,"For thy name's sake, O LORD, pardon mine iniquity; for it is great. "
H5545,Psa,19,103,3,H5545-19-103-3,Who forgiveth all thine iniquities; who healeth all thy diseases; 
H5545,Isa,23,55,7,H5545-23-55-7,"Let the wicked forsake his way, and the unrighteous man his thoughts: and let him return unto the LORD, and he will have mercy upon him; and to our God, for he will abundantly pardon. "
H5545,Jer,24,5,1,H5545-24-5-1,"Run ye to and fro through the streets of Jerusalem, and see now, and know, and seek in the broad places thereof, if ye can find a man, if there be any that executeth judgment, that seeketh the truth; and I will pardon it."
H5545,Jer,24,5,7,H5545-24-5-7,"How shall I pardon thee for this? thy children have forsaken me, and sworn by them that are no gods: when I had fed them to the full, they then committed adultery, and assembled themselves by troops in the harlots' houses. "
H5545,Jer,24,31,34,H5545-24-31-34,"And they shall teach no more every man his neighbour, and every man his brother, saying, Know the LORD: for they shall all know me, from the least of them unto the greatest of them, saith the LORD: for I will forgive their iniquity, and I will remember their sin no more."
H5545,Jer,24,33,8,H5545-24-33-8,"And I will cleanse them from all their iniquity, whereby they have sinned against me; and I will pardon all their iniquities, whereby they have sinned, and whereby they have transgressed against me."
H5545,Jer,24,36,3,H5545-24-36-3,It may be that the house of Judah will hear all the evil which I purpose to do unto them; that they may return every man from his evil way; that I may forgive their iniquity and their sin. 
H5545,Jer,24,50,20,H5545-24-50-20,"In those days, and in that time, saith the LORD, the iniquity of Israel shall be sought for, and there shall be none; and the sins of Judah, and they shall not be found: for I will pardon them whom I reserve. "
H5545,Lam,25,3,42,H5545-25-3-42,We have transgressed and have rebelled: thou hast not pardoned. 
H5545,Dan,27,9,19,H5545-27-9-19,"O Lord, hear; O Lord, forgive; O Lord, hearken and do; defer not, for thine own sake, O my God: for thy city and thy people are called by thy name. "
H5545,Amo,30,7,2,H5545-30-7-2,"And it came to pass, that when they had made an end of eating the grass of the land, then I said, O Lord GOD, forgive, I beseech thee: by whom shall Jacob arise? for he is small. "
H5546,Psa,19,86,5,H5546-19-86-5,"For thou, Lord, art good, and ready to forgive; and plenteous in mercy unto all them that call upon thee."
H5547,Neh,16,9,17,H5547-16-9-17,"And refused to obey, neither were mindful of thy wonders that thou didst among them; but hardened their necks, and in their rebellion appointed a captain to return to their bondage: but thou art a God ready to pardon, gracious and merciful, slow to anger, and of great kindness, and forsookest them not."
H5547,Psa,19,130,4,H5547-19-130-4,"But there is forgiveness with thee, that thou mayest be feared. "
H5547,Dan,27,9,9,H5547-27-9-9,"To the Lord our God belong mercies and forgivenesses, though we have rebelled against him;"
G859,Mat,40,26,28,G859-40-26-28,"For this is my blood of the new testament, which is shed for many for the remission of sins. "
G859,Mar,41,1,4,G859-41-1-4,"John did baptize in the wilderness, and preach the baptism of repentance for the remission of sins. "
G859,Mar,41,3,29,G859-41-3-29,"But he that shall blaspheme against the Holy Ghost hath never forgiveness, but is in danger of eternal damnation: "
G859,Luk,42,1,77,G859-42-1-77,"To give knowledge of salvation unto his people by the remission of their sins, "
G859,Luk,42,3,3,G859-42-3-3,"And he came into all the country about Jordan, preaching the baptism of repentance for the remission of sins; "
G859,Luk,42,4,18,G859-42-4-18,"The Spirit of the Lord is upon me, because he hath anointed me to preach the gospel to the poor; he hath sent me to heal the brokenhearted, to preach deliverance to the captives, and recovering of sight to the blind, to set at liberty them that are bruised, "
G859,Luk,42,24,47,G859-42-24-47,"And that repentance and remission of sins should be preached in his name among all nations, beginning at Jerusalem. "
